{
  "schema_version": "1.0.0",
  "protocol_id": "GEO-CAP-001",
  "run_id": "replace-with-frozen-run-id",
  "model": {
    "identifier": "replace-namespace/replace-model",
    "revision": "0000000000000000000000000000000000000000",
    "revision_kind": "hf_commit",
    "revision_tree_sha256": "0000000000000000000000000000000000000000000000000000000000000000",
    "tokenizer_identifier": "replace-namespace/replace-tokenizer",
    "tokenizer_revision": "0000000000000000000000000000000000000000",
    "tokenizer_revision_kind": "hf_commit",
    "tokenizer_revision_tree_sha256": "0000000000000000000000000000000000000000000000000000000000000000"
  },
  "backend": {
    "name": "huggingface-pytorch",
    "local_files_only": true,
    "trust_remote_code": false,
    "device": "cpu",
    "dtype": "float32",
    "quantization": "none"
  },
  "capture": {
    "context_mode": "cumulative",
    "phase": "replayed_prefix",
    "layers": [0, 1],
    "pooling": {"mode": "step_mean"},
    "prefix_text": "Reason through the following steps carefully.",
    "step_joiner": "\n"
  },
  "determinism": {
    "mode": "required",
    "seed": 0
  },
  "generation_parameters": {
    "generation_used": false,
    "temperature": null,
    "top_p": null,
    "top_k": null
  },
  "steps": [
    {
      "step_id": "step-001",
      "text": "Replace this with the first preregistered reasoning segment."
    },
    {
      "step_id": "step-002",
      "text": "Replace this with the second preregistered reasoning segment."
    }
  ],
  "notes": "Template only. Replace the repository identifiers and zero 40-hex revisions first. While ONLINE, run `qsol-geo-capture REQUEST.json --prepare-tree-receipts`. That explicit trusted warm-up queries the Hugging Face Hub for each exact immutable commit, warms the ordinary blobs/refs/snapshots cache, creates QSOL's own trees/<commit>.json artifact, and prints revision_tree_sha256 plus tokenizer_revision_tree_sha256. Freeze those printed SHA-256 values into this request, then perform the canonical capture offline. Ordinary huggingface_hub snapshot_download does NOT create QSOL's trees/<commit>.json artifact by itself. --validate-only checks request semantics but does not contact the Hub or generate these receipts."
}
